title,url,thumbnail_url,channel,description
Minecraft Speedrunner VS 5 Hunters FINALE REMATCH,https://www.youtube.com/watch?v=_0MXhG1shEc,https://i.ytimg.com/vi/_0MXhG1shEc/hqdefault.jpg?sqp=-oaymwEcCPYBEIoBSFXyq4qpAw4IARUAAIhCGAFwAcABBg==&rs=AOn4CLAo2EhxSkvya0xLAXstem-O6sA72Q,Dream,Minecraft Speedrunner VS 5 Hunters FINALE REMATCH. You asked for it. This was absolutely insane. https://cash.app/13+ use code DreamYT for $15 free Follow my socials: ➽ Twitter - @dream...
Kodak Black - Closure [Official Music VIdeo],https://www.youtube.com/watch?v=MIvhuTmmVUQ,https://i.ytimg.com/vi/MIvhuTmmVUQ/hqdefault.jpg?sqp=-oaymwEcCPYBEIoBSFXyq4qpAw4IARUAAIhCGAFwAcABBg==&rs=AOn4CLDE4KrHEoPnXcfcQFxgY3RZ9glTSA,Kodak Black,Kodak Black - Closure [Official Music VIdeo] Subscribe for more official content from Kodak Black: https://Atlantic.lnk.to/KBsubscribe Follow Kodak Black https://twitter.com/KodakBlack1k...
POWER OF MAKEUP: Adele! | NikkieTutorials,https://www.youtube.com/watch?v=qY3L1bPNBAw,https://i.ytimg.com/vi/qY3L1bPNBAw/hqdefault.jpg?sqp=-oaymwEcCPYBEIoBSFXyq4qpAw4IARUAAIhCGAFwAcABBg==&rs=AOn4CLB3eXnIOuKJrO59lLE5ZynkYpaMww,NikkieTutorials,"Please welcome to my channel: ADELE!!! - CAN SOMEONE PINCH ME?? I’ve been dreaming of working with Adele for YEARS now, so when she asked me to do her makeup to celebrate the launch of her..."
The Walters - I Love You So [Official Video],https://www.youtube.com/watch?v=HZX7MB_m13M,https://i.ytimg.com/vi/HZX7MB_m13M/hqdefault.jpg?sqp=-oaymwEcCPYBEIoBSFXyq4qpAw4IARUAAIhCGAFwAcABBg==&rs=AOn4CLABPN15M7h-mf41cQ8Wea7xSVleOw,The Walters,"Listen to ""I Love You So:"" https://thewalters.lnk.to/iloveyouso vinyl and t-shirts available at http://www.yourwalters.com https://instagram.com/thewalters_ https://www.facebook.com/TheWaltersban..."
Redemption,https://www.youtube.com/watch?v=UxBc-dEAsbs,,Deji,One Last Chance Join the TANK GANG ►http://bit.ly/1h6i9oR Instagram ► http://instagram.com/comedygamer Twitter ► https://twitter.com/Deji Facebook ► https://www.facebook.com/ComedyShortsGa...
YouTubers Play SQUID GAME In Real Life! *NEW CHALLENGES*,https://www.youtube.com/watch?v=KEjC5BsCQ_E,,Jordan Matter,21 YouTubers play Squid Game in real life with never before seen challenges to win $1000 for a subscriber. Watch until the end - it might be you! SUBSCRIBE & turn on POST NOTIFICATIONS for...
Apex Legends: Raiders Collection Event Trailer,https://www.youtube.com/watch?v=A_GUBourLrc,,Apex Legends,"It’s a pirate’s life for our Legends in the Raiders Collection Event! http://x.ea.com/71586 Winter Express returns to Apex Legends: three squads board the World’s Edge train, but only..."
Juice WRLD & Justin Bieber - Wandered To LA (Official Trailer),https://www.youtube.com/watch?v=59bdqLHHqLo,,Juice WRLD,"Pre-Save ""Wandered To LA"": https://JuiceWrld.lnk.to/WanderedToLAPreSave Get your tickets to juice wrld day at Juicewrldday.com Check out more Juice WRLD here: Merch- 999club.com Soundcloud..."
LAST DAY AT THE ACE FAMILY HOUSE! **BYE FOREVER**,https://www.youtube.com/watch?v=v_9jZ8R9VRA,,The ACE Family,LAST DAY AT THE ACE FAMILY HOUSE! **BYE FOREVER** **ACE FAMILY MERCH HERE: shopacefamily.com LAST VIDEO: https://www.youtube.com/watch?v=Ud5xlPGK09w JOIN THE ACE FAMILY & SUBSCRIBE: http://bit.l...
Redneck vs “Sweet Tea”,https://www.youtube.com/watch?v=Rm1BWVnsKhE,,Drew Talbert,Timothy knows you the only way to make Sweet Tea is to add a shocking amount of sugar while it’s brewing Co-write w/ Andrea Kelley
